mesure,indicateur,id_indicateur,valeur_actuelle,date_valeur_actuelle,valeur_initiale,date_valeur_initiale,progression,pourcentage_progression,cible,pourcentage_cible,date_cible,unite,maille
Offrir un logement aux sans-abris : Logement d’abord,Nombre de personnes sans abri ou en hébergement ayant obtenu un logement social,logement-sans-domicile-hebergement-urgence,1410.0,2019-12-31,1239.0,2017-12-31,171.0,14.0,,,,personnes dans l'année,0 - departemental
"Proposer une offre de lunettes, appareils auditifs et prothèses dentaires remboursée à 100%",Part des équipements/soins 100% santé dans le total des soins optiques,tx-equipements-optique,8.88,2020-10-31,6.42,2020-01-31,2.0,38.0,,,,%,0 - departemental
"Proposer une offre de lunettes, appareils auditifs et prothèses dentaires remboursée à 100%",Part des équipements/soins auditives 100% santé dans le total des soins,tx-equipements-audio,11.48,2020-10-31,12.14,2019-03-31,-1.0,-5.0,,,,%,0 - departemental
Simplifier l’accès aux droits des personnes handicapées,Durée moyenne de traitement pour les demandes d’allocation adulte handicapé,duree-moyenne-traitement-demandes-allocation-adulte-handicape,5.8,2020-09-30,6.6,2017-12-31,-1.0,-12.0,3.0,22.0,2022-12-31,mois de traitement,0 - departemental
"Dédoubler les classes en REP (grande section, CP, CE1)",Part de grande section en REP dédoublées,tx-gs-rep,30.0,2020-11-30,26.0,2019-11-30,4.0,15.0,68.0,10.0,2022-11-30,% des classes,0 - departemental
"Dédoubler les classes en REP (grande section, CP, CE1)",Part des classes de CP et CE1 en REP dédoublées,tx-classes-cp-ce1-rep,100.0,2020-10-31,97.0,2019-10-31,3.0,3.0,,,,% des classes,0 - departemental
Allonger le congé paternité pour un meilleur développement de l’enfant,Nombre de pères / conjoints prenant un congé de paternité et d’accueil de l’enfant,nb-peres-conge-paternite,8458.0,2019-12-31,,,,,,,,pères dans l'année,0 - departemental
"Limiter les classes à 24 en grande section, CP, CE1","Part des classes de GS, CP ou CE1 ayant un effectif inférieur ou égal à 24 élèves",tx-classes-cp-ce1,61.0,2020-09-30,58.0,2019-09-30,3.0,5.0,100.0,7.0,2022-09-30,% des classes,0 - departemental
Réduire la mortalité sur les routes,Nombre de morts sur les routes,nb-morts-routes,71.0,2019-12-31,81.0,2017-12-31,-10.0,-12.0,,,,morts dans l'année,0 - departemental
Déployer Parcoursup ,Taux de réussite aux examens de licence 1,tx-reussite-examens,40.0,2019-10-31,38.0,2017-10-31,2.0,5.0,,,,% de réussite,0 - departemental
Améliorer la qualité du service rendu à l’usager,Part des lieux d’accueil du public qui publient leurs résultats,tx-transparence-resultats,69.0,2019-12-31,12.0,2017-12-31,57.0,475.0,,,,%,0 - departemental
Supprimer la taxe d’habitation sur les résidences principales,Nombre de bénéficiaires totalement exonérés,nb-beneficiaires-suppression-taxe-habitation,391157.0,2020-12-31,0.0,2017-01-01,391157.0,,391159.0,100.0,2022-12-31,bénéficiaires,0 - departemental
Doubler le nombre de maisons de santé,Nombre de maisons de santé pluri-professionnelles,nb-maisons-sante,15.0,2020-06-30,10.0,2017-06-30,5.0,50.0,,,,maisons de santé,0 - departemental
Déployer une offre France Services dans tous les territoires ,Nombre de labellisations (atteinte de l'objectif fixé),nb-labellisations-france-services,10.0,2020-11-30,0.0,2017-01-01,10.0,,32.0,31.0,2022-12-31,labellisations,0 - departemental
Déployer le plan vélo,Kilomètres d'aménagements cyclables sécurisés,km-amenagement-cyclables-securises,971.0,2020-09-30,709.0,2017-12-31,262.0,37.0,980.0,97.0,2022-03-31,kilomètres,0 - departemental
Mettre en œuvre la sortie du plastique à usage unique et lutter contre le gaspillage,Nombre de Français qui peuvent mettre tous les emballages dans le bac jaune,nb-francais-emballages-bac-jaune,860000.0,2020-06-30,190000.0,2017-06-30,670000.0,353.0,1390000.0,56.0,2022-12-31,habitants,0 - departemental
Verdir le parc automobile,Nombre de primes à la conversion et de bonus écologiques,nb-primes-conversion,12031.0,2020-09-30,0.0,2018-03-31,12031.0,,,,,primes et bonus,0 - departemental
Développer l’apprentissage,Nombre de contrats d’apprentissage,nombre-contrats-apprentissage,7549.0,2019-12-31,5697.0,2017-12-31,1852.0,33.0,,,,contrats,0 - departemental
Assurer une bonne couverture en internet fixe et en téléphonie mobile pour tous les Français d'ici 2022,Taux de déploiement de la fibre,taux-deploiement-fibre,70.0,2020-06-30,27.0,2017-12-31,43.0,159.0,,,,% de déploiement,0 - departemental
Offrir une scolarisation inclusive à tous les enfants handicapés,"Nombre d’unités locales d’inclusion scolaires (ULIS) pour les élèves en situation de handicap à l’école maternelle, à l’école élémentaire, au collège et au lycée",nombre-creation-ulis,187.0,2020-09-30,160.0,2017-09-30,27.0,17.0,205.0,60.0,2022-09-30,unités,0 - departemental
Offrir une scolarisation inclusive à tous les enfants handicapés,Nombre de classes adaptées à la scolarisation des enfants autistes (UEMA/UEEA) à l’école maternelle et à l’école élémentaire,nombre-creation-ueea,4.0,2020-09-30,2.0,2017-09-30,2.0,100.0,6.0,50.0,2022-09-30,classes,0 - departemental
Lutter contre les stupéfiants,Nombre d'amendes forfaitaires délictuelles dressées,nb-amendes-delictuelles-dressees,398.0,2020-10-31,,,,,,,,amendes dressées dans l'année,0 - departemental
Plan #1jeune1solution,Nombre de recrutements de jeunes,nombre-recrutements-jeunes,49414.0,2019-12-31,45408.0,2018-12-31,4006.0,9.0,,,,recrutements dans l'année,0 - departemental
Pacte d’ambition pour l’insertion par l’activité économique,Nombre de bénéficiaires en structures d’insertion par l’activité économique,nb-beneficiaires-siae,2101.0,2020-07-31,2005.0,2018-01-31,96.0,5.0,,,,bénéficiaires par mois,1 - regional
Lutter contre les atteintes aux principes républicains,Nombre de contrôles réalisés par les plans de lutte contre la radicalisation dans les quartiers (PLR-Q) et les cellules départementales de lutte contre l'islamisme et le repli communautaire (CLIR),nb-controles-clir,2457.0,2019-12-31,2651.0,2018-12-31,-194.0,-7.0,,,,contrôles dans l'année,1 - regional
Déployer le Pass culture,Nombre d’utilisateurs du Pass culture,nb-utilisateurs-pass-culture,26238.0,2020-10-31,0.0,2017-01-01,26238.0,,,,,utilisateurs,1 - regional
Lutter contre les violences faites aux femmes,Nombre d’ordonnances de protection délivrées,nb-ordonnances-delivrees,1203.0,2019-12-31,1072.0,2017-12-31,131.0,12.0,,,,ordonnances dans l'année,1 - regional
Instaurer des zones à faibles émissions,Nombre d'habitants vivant à l'intérieur d'une zone à faible émission,nb-habitants-zfe,3905110.0,2020-12-31,2220445.0,2017-12-31,1684665.0,76.0,,,,habitants,1 - regional
Améliorer la qualité du service rendu à l’usager,Taux de satisfaction des usagers à l’égard des services publics,tx-satisfaction-usagers-services-publics,76.0,2020-12-31,72.0,2017-12-31,4.0,6.0,77.0,80.0,2022-12-31,% de satisfaction,2 - national
Renforcer la sécurité du quotidien,Nombre d’heures de patrouille de voie publique,nb-heures-patrouille,68941131.0,2019-12-31,68437499.0,2017-12-31,503632.0,1.0,,,,heures de patrouille dans l'année,2 - national
"Proposer une offre de lunettes, appareils auditifs et prothèses dentaires remboursée à 100%",Part des équipements/soins 100% santé dans le total des soins dentaire,tx-equipements-dentaire,51.9,2020-09-30,26.08,2019-04-30,26.0,99.0,45.0,136.0,2022-12-31,%,2 - national
