mesure,indicateur,id_indicateur,valeur_actuelle,date_valeur_actuelle,valeur_initiale,date_valeur_initiale,progression,pourcentage_progression,cible,pourcentage_cible,date_cible,unite,maille
Offrir un logement aux sans-abris : Logement d’abord,Nombre de personnes sans abri ou en hébergement ayant obtenu un logement social,logement-sans-domicile-hebergement-urgence,451.0,2019-12-31,418.0,2017-12-31,33.0,8.0,,,,personnes dans l'année,0 - departemental
"Proposer une offre de lunettes, appareils auditifs et prothèses dentaires remboursée à 100%",Part des équipements/soins 100% santé dans le total des soins optiques,tx-equipements-optique,12.32,2020-10-31,8.45,2020-01-31,4.0,46.0,,,,%,0 - departemental
"Proposer une offre de lunettes, appareils auditifs et prothèses dentaires remboursée à 100%",Part des équipements/soins auditives 100% santé dans le total des soins,tx-equipements-audio,9.82,2020-10-31,13.36,2019-03-31,-4.0,-26.0,,,,%,0 - departemental
Simplifier l’accès aux droits des personnes handicapées,Durée moyenne de traitement pour les demandes d’allocation adulte handicapé,duree-moyenne-traitement-demandes-allocation-adulte-handicape,4.1,2019-12-31,4.0,2017-12-31,0.0,2.0,3.0,-10.0,2022-12-31,mois de traitement,0 - departemental
"Dédoubler les classes en REP (grande section, CP, CE1)",Part de grande section en REP dédoublées,tx-gs-rep,9.0,2020-11-30,0.0,2019-11-30,9.0,,72.0,12.0,2022-11-30,% des classes,0 - departemental
"Dédoubler les classes en REP (grande section, CP, CE1)",Part des classes de CP et CE1 en REP dédoublées,tx-classes-cp-ce1-rep,100.0,2020-10-31,90.0,2019-10-31,10.0,11.0,,,,% des classes,0 - departemental
Allonger le congé paternité pour un meilleur développement de l’enfant,Nombre de pères / conjoints prenant un congé de paternité et d’accueil de l’enfant,nb-peres-conge-paternite,4166.0,2019-12-31,,,,,,,,pères dans l'année,0 - departemental
"Limiter les classes à 24 en grande section, CP, CE1","Part des classes de GS, CP ou CE1 ayant un effectif inférieur ou égal à 24 élèves",tx-classes-cp-ce1,64.0,2020-09-30,59.0,2019-09-30,5.0,8.0,100.0,12.0,2022-09-30,% des classes,0 - departemental
Réduire la mortalité sur les routes,Nombre de morts sur les routes,nb-morts-routes,73.0,2019-12-31,72.0,2017-12-31,1.0,1.0,,,,morts dans l'année,0 - departemental
Déployer Parcoursup ,Taux de réussite aux examens de licence 1,tx-reussite-examens,44.0,2019-10-31,34.0,2017-10-31,10.0,29.0,,,,% de réussite,0 - departemental
Améliorer la qualité du service rendu à l’usager,Part des lieux d’accueil du public qui publient leurs résultats,tx-transparence-resultats,59.0,2019-12-31,12.0,2017-12-31,47.0,392.0,,,,%,0 - departemental
Supprimer la taxe d’habitation sur les résidences principales,Nombre de bénéficiaires totalement exonérés,nb-beneficiaires-suppression-taxe-habitation,388025.0,2020-12-31,0.0,2017-01-01,388025.0,,388025.0,100.0,2022-12-31,bénéficiaires,0 - departemental
Doubler le nombre de maisons de santé,Nombre de maisons de santé pluri-professionnelles,nb-maisons-sante,7.0,2020-06-30,3.0,2017-06-30,4.0,133.0,,,,maisons de santé,0 - departemental
Déployer une offre France Services dans tous les territoires ,Nombre de labellisations (atteinte de l'objectif fixé),nb-labellisations-france-services,6.0,2020-11-30,0.0,2017-01-01,6.0,,24.0,25.0,2022-12-31,labellisations,0 - departemental
Déployer le plan vélo,Kilomètres d'aménagements cyclables sécurisés,km-amenagement-cyclables-securises,463.0,2020-09-30,384.0,2017-12-31,79.0,21.0,531.0,54.0,2022-03-31,kilomètres,0 - departemental
Mettre en œuvre la sortie du plastique à usage unique et lutter contre le gaspillage,Nombre de Français qui peuvent mettre tous les emballages dans le bac jaune,nb-francais-emballages-bac-jaune,520000.0,2020-06-30,500000.0,2017-06-30,20000.0,4.0,1050000.0,4.0,2022-12-31,habitants,0 - departemental
Verdir le parc automobile,Nombre de primes à la conversion et de bonus écologiques,nb-primes-conversion,14543.0,2020-09-30,0.0,2018-03-31,14543.0,,,,,primes et bonus,0 - departemental
Développer l’apprentissage,Nombre de contrats d’apprentissage,nombre-contrats-apprentissage,5077.0,2019-12-31,4230.0,2017-12-31,847.0,20.0,,,,contrats,0 - departemental
Assurer une bonne couverture en internet fixe et en téléphonie mobile pour tous les Français d'ici 2022,Taux de déploiement de la fibre,taux-deploiement-fibre,39.0,2020-06-30,12.0,2017-12-31,27.0,225.0,,,,% de déploiement,0 - departemental
Offrir une scolarisation inclusive à tous les enfants handicapés,"Nombre d’unités locales d’inclusion scolaires (ULIS) pour les élèves en situation de handicap à l’école maternelle, à l’école élémentaire, au collège et au lycée",nombre-creation-ulis,122.0,2020-09-30,103.0,2017-09-30,19.0,18.0,134.0,61.0,2022-09-30,unités,0 - departemental
Offrir une scolarisation inclusive à tous les enfants handicapés,Nombre de classes adaptées à la scolarisation des enfants autistes (UEMA/UEEA) à l’école maternelle et à l’école élémentaire,nombre-creation-ueea,4.0,2020-09-30,1.0,2017-09-30,3.0,300.0,5.0,75.0,2022-09-30,classes,0 - departemental
Lutter contre les stupéfiants,Nombre d'amendes forfaitaires délictuelles dressées,nb-amendes-delictuelles-dressees,367.0,2020-10-31,,,,,,,,amendes dressées dans l'année,0 - departemental
Plan #1jeune1solution,Nombre de recrutements de jeunes,nombre-recrutements-jeunes,32682.0,2019-12-31,30969.0,2018-12-31,1713.0,6.0,,,,recrutements dans l'année,0 - departemental
Pacte d’ambition pour l’insertion par l’activité économique,Nombre de bénéficiaires en structures d’insertion par l’activité économique,nb-beneficiaires-siae,2030.0,2020-07-31,1729.0,2018-01-31,301.0,17.0,,,,bénéficiaires par mois,1 - regional
Lutter contre les atteintes aux principes républicains,Nombre de contrôles réalisés par les plans de lutte contre la radicalisation dans les quartiers (PLR-Q) et les cellules départementales de lutte contre l'islamisme et le repli communautaire (CLIR),nb-controles-clir,221.0,2019-12-31,177.0,2018-12-31,44.0,25.0,,,,contrôles dans l'année,1 - regional
Déployer le Pass culture,Nombre d’utilisateurs du Pass culture,nb-utilisateurs-pass-culture,2721.0,2020-10-31,0.0,2017-01-01,2721.0,,,,,utilisateurs,1 - regional
Lutter contre les violences faites aux femmes,Nombre d’ordonnances de protection délivrées,nb-ordonnances-delivrees,418.0,2019-12-31,312.0,2017-12-31,106.0,34.0,,,,ordonnances dans l'année,1 - regional
Améliorer la qualité du service rendu à l’usager,Taux de satisfaction des usagers à l’égard des services publics,tx-satisfaction-usagers-services-publics,76.0,2020-12-31,72.0,2017-12-31,4.0,6.0,77.0,80.0,2022-12-31,% de satisfaction,2 - national
Renforcer la sécurité du quotidien,Nombre d’heures de patrouille de voie publique,nb-heures-patrouille,68941131.0,2019-12-31,68437499.0,2017-12-31,503632.0,1.0,,,,heures de patrouille dans l'année,2 - national
"Proposer une offre de lunettes, appareils auditifs et prothèses dentaires remboursée à 100%",Part des équipements/soins 100% santé dans le total des soins dentaire,tx-equipements-dentaire,51.9,2020-09-30,26.08,2019-04-30,26.0,99.0,45.0,136.0,2022-12-31,%,2 - national
Instaurer des zones à faibles émissions,Nombre d'habitants vivant à l'intérieur d'une zone à faible émission,nb-habitants-zfe,5102636.0,2020-12-31,2220445.0,2017-12-31,2882191.0,130.0,,,,habitants,2 - national
